{
  "version": 1,
  "pack_id": "representative-coding-pack-001",
  "status": "ready",
  "experiment_ref": "examples/evaluation-task-pack-experiment.json",
  "experiment_id": "exp-representative-workflows-001",
  "plan_fingerprint": "1157452cc3d1e86a4896fbb666f2c750213433f6f86168aaf47813ad44a45711",
  "pack_fingerprint": "3f4742acf8a40dec742bf60c6b6ab74b8cbd11cd99bb2b8565450cc7254e69df",
  "distinct_repository_count": 3,
  "categories": [
    "bounded-bug-fix",
    "multi-file-feature",
    "multi-step-evolution"
  ],
  "task_count": 3,
  "seed_count": 3,
  "arm_count": 2,
  "matrix_size": 18,
  "model_calls_performed": false,
  "tasks": [
    {
      "id": "median-fix",
      "category": "bounded-bug-fix",
      "repository": "examples/live-pilot-template",
      "repository_fingerprint": "4082038c8718990f1519758b07493511386de60920646e1aa4f0185b085ddf3d",
      "repository_entry_count": 13,
      "baseline_outcome": "fail",
      "failing_evaluator_ids": ["median-tests"],
      "protected_regressions": []
    },
    {
      "id": "restock-report",
      "category": "multi-file-feature",
      "repository": "examples/task-pack/multi-file-feature",
      "repository_fingerprint": "05fa7e5b3925a81ddd784ca8a6cc7649d31b3a68e38253b7f5e937d5632205ee",
      "repository_entry_count": 14,
      "baseline_outcome": "fail",
      "failing_evaluator_ids": ["restock-tests"],
      "protected_regressions": []
    },
    {
      "id": "roadmap-evolution",
      "category": "multi-step-evolution",
      "repository": "examples/task-pack/multi-step-evolution",
      "repository_fingerprint": "a0755e27933734214716dbbd5edcbfc7e7edb125bea38a1f6ed94680815ad7dc",
      "repository_entry_count": 14,
      "baseline_outcome": "fail",
      "failing_evaluator_ids": ["roadmap-tests"],
      "protected_regressions": []
    }
  ],
  "report_id": "task-pack-readiness-80145ad33c0cfb27",
  "fingerprint": "80145ad33c0cfb27e47e7aeaa3886ac4cb7a54583fabba34df61bd4c832ea978"
}
